[
  {
    "id": "src-044455c699ee",
    "url": "https://www.interfax.ru/russia/1093272",
    "title": "Интерфакс об атаке БПЛА на автобус “Рубежное - Кременная”",
    "publisher": "interfax.ru",
    "registeredAt": "2026-06-20",
    "accessedAt": null,
    "archiveUrl": null,
    "localCopy": null,
    "sha256": null,
    "status": "referenced",
    "notes": "Источник зарегистрирован автоматически по ссылке в публикации; дата доступа и архивная копия заполняются вручную для ключевых доказательств.",
    "preservationPriority": "normal",
    "referencedBy": [
      "krm-2026-06-06"
    ]
  },
  {
    "id": "src-0d0a37a789e6",
    "url": "https://lug-info.ru/news/ukrainskie-drony-atakovali-gosuchrezhdenie-v-belokurakino-raneny-15-sotrudnikov/",
    "title": "Белокуракино",
    "publisher": "lug-info.ru",
    "registeredAt": "2026-06-20",
    "accessedAt": null,
    "archiveUrl": null,
    "localCopy": null,
    "sha256": null,
    "status": "referenced",
    "notes": "Источник зарегистрирован автоматически по ссылке в публикации; дата доступа и архивная копия заполняются вручную для ключевых доказательств.",
    "preservationPriority": "normal",
    "referencedBy": [
      "bpla-lnr-2026-05-27"
    ]
  },
  {
    "id": "src-10a3279f138c",
    "url": "https://zn.ua/UKRAINE/mvd-obnarodovalo-spisok-pogibshih-ot-vzryva-v-luganskoy-oga-146389_.html",
    "title": "ZN.ua: сообщение о списке погибших, опубликованном украинской милицией",
    "publisher": "zn.ua",
    "registeredAt": "2026-06-20",
    "accessedAt": null,
    "archiveUrl": null,
    "localCopy": null,
    "sha256": null,
    "status": "referenced",
    "notes": "Источник зарегистрирован автоматически по ссылке в публикации; дата доступа и архивная копия заполняются вручную для ключевых доказательств.",
    "preservationPriority": "high",
    "referencedBy": [
      "lugansk-2014-06-02"
    ]
  },
  {
    "id": "src-126409d4adc0",
    "url": "https://sovminlnr.ru/docs/2024/12/13/281_24.pdf",
    "title": "Постановление Правительства ЛНР № 281/24",
    "publisher": "sovminlnr.ru",
    "registeredAt": "2026-06-20",
    "accessedAt": null,
    "archiveUrl": null,
    "localCopy": null,
    "sha256": null,
    "status": "referenced",
    "notes": "Источник зарегистрирован автоматически по ссылке в публикации; дата доступа и архивная копия заполняются вручную для ключевых доказательств.",
    "preservationPriority": "medium",
    "referencedBy": [
      "vuplatylnr-2026-05-25"
    ]
  },
  {
    "id": "src-140a8e92652e",
    "url": "https://ihl-databases.icrc.org/en/customary-ihl/v1/rule14",
    "title": "обычное МГП, правило 14 о пропорциональности",
    "publisher": "ihl-databases.icrc.org",
    "registeredAt": "2026-06-20",
    "accessedAt": null,
    "archiveUrl": null,
    "localCopy": null,
    "sha256": null,
    "status": "referenced",
    "notes": "Источник зарегистрирован автоматически по ссылке в публикации; дата доступа и архивная копия заполняются вручную для ключевых доказательств.",
    "preservationPriority": "normal",
    "referencedBy": [
      "posle-gosudarstva-2026-06-12"
    ]
  },
  {
    "id": "src-147295976366",
    "url": "https://ukraine.ohchr.org/sites/default/files/2024-03/UAReport19th_RUS_0.pdf",
    "title": "OHCHR: периодический доклад 2017-2018 годов",
    "publisher": "ukraine.ohchr.org",
    "registeredAt": "2026-06-20",
    "accessedAt": null,
    "archiveUrl": null,
    "localCopy": null,
    "sha256": null,
    "status": "referenced",
    "notes": "Источник зарегистрирован автоматически по ссылке в публикации; дата доступа и архивная копия заполняются вручную для ключевых доказательств.",
    "preservationPriority": "high",
    "referencedBy": [
      "lugansk-2014-06-02"
    ]
  },
  {
    "id": "src-168426597281",
    "url": "https://ombudsmanrf.org/appeal",
    "title": "ombudsmanrf.org/appeal",
    "publisher": "ombudsmanrf.org",
    "registeredAt": "2026-06-20",
    "accessedAt": null,
    "archiveUrl": null,
    "localCopy": null,
    "sha256": null,
    "status": "referenced",
    "notes": "Источник зарегистрирован автоматически по ссылке в публикации; дата доступа и архивная копия заполняются вручную для ключевых доказательств.",
    "preservationPriority": "medium",
    "referencedBy": [
      "evak-2026-03-10"
    ]
  },
  {
    "id": "src-197341de9549",
    "url": "https://publication.pravo.gov.ru/document/8100202605250001",
    "title": "Указ Главы ЛНР № УГ-449/26 о введении режима ЧС",
    "publisher": "publication.pravo.gov.ru",
    "registeredAt": "2026-06-20",
    "accessedAt": null,
    "archiveUrl": null,
    "localCopy": null,
    "sha256": null,
    "status": "referenced",
    "notes": "Источник зарегистрирован автоматически по ссылке в публикации; дата доступа и архивная копия заполняются вручную для ключевых доказательств.",
    "preservationPriority": "medium",
    "referencedBy": [
      "lnr-vyplaty-terakt-118-26"
    ]
  },
  {
    "id": "src-208740499ec7",
    "url": "https://gvp.gov.ru/gvp/reception/go",
    "title": "gvp.gov.ru/gvp/reception/go",
    "publisher": "gvp.gov.ru",
    "registeredAt": "2026-06-20",
    "accessedAt": null,
    "archiveUrl": null,
    "localCopy": null,
    "sha256": null,
    "status": "referenced",
    "notes": "Источник зарегистрирован автоматически по ссылке в публикации; дата доступа и архивная копия заполняются вручную для ключевых доказательств.",
    "preservationPriority": "medium",
    "referencedBy": [
      "evak-2026-03-10"
    ]
  },
  {
    "id": "src-22ce7f5aec0b",
    "url": "https://base.garant.ru/409044928/",
    "title": "Постановление Правительства ЛНР N 113/24",
    "publisher": "base.garant.ru",
    "registeredAt": "2026-06-20",
    "accessedAt": null,
    "archiveUrl": null,
    "localCopy": null,
    "sha256": null,
    "status": "referenced",
    "notes": "Источник зарегистрирован автоматически по ссылке в публикации; дата доступа и архивная копия заполняются вручную для ключевых доказательств.",
    "preservationPriority": "medium",
    "referencedBy": [
      "powrlnr-2026-05-13"
    ]
  },
  {
    "id": "src-2a459ce2aa67",
    "url": "https://lug-info.ru/news/mintopenergo-prinjato-reshenie-ob-ogranichenii-otpuska-benzina-na-azs-v-lnr/",
    "title": "ЛИЦ о временном ограничении отпуска топлива в ЛНР",
    "publisher": "lug-info.ru",
    "registeredAt": "2026-06-20",
    "accessedAt": null,
    "archiveUrl": null,
    "localCopy": null,
    "sha256": null,
    "status": "referenced",
    "notes": "Источник зарегистрирован автоматически по ссылке в публикации; дата доступа и архивная копия заполняются вручную для ключевых доказательств.",
    "preservationPriority": "normal",
    "referencedBy": [
      "krm-2026-06-06"
    ]
  },
  {
    "id": "src-2b9ec16c4f35",
    "url": "https://max.ru/government_lnr",
    "title": "Правительство ЛНР",
    "publisher": "max.ru",
    "registeredAt": "2026-06-20",
    "accessedAt": null,
    "archiveUrl": null,
    "localCopy": null,
    "sha256": null,
    "status": "referenced",
    "notes": "Источник зарегистрирован автоматически по ссылке в публикации; дата доступа и архивная копия заполняются вручную для ключевых доказательств.",
    "preservationPriority": "medium",
    "referencedBy": [
      "vuplatylnr-2026-05-25"
    ]
  },
  {
    "id": "src-2bf48999141c",
    "url": "https://letters.mil.ru/electronic_reception.htm",
    "title": "letters.mil.ru/electronic_reception.htm",
    "publisher": "letters.mil.ru",
    "registeredAt": "2026-06-20",
    "accessedAt": null,
    "archiveUrl": null,
    "localCopy": null,
    "sha256": null,
    "status": "referenced",
    "notes": "Источник зарегистрирован автоматически по ссылке в публикации; дата доступа и архивная копия заполняются вручную для ключевых доказательств.",
    "preservationPriority": "medium",
    "referencedBy": [
      "evak-2026-03-10"
    ]
  },
  {
    "id": "src-32ecc907c6e2",
    "url": "https://publication.pravo.gov.ru/document/0001201912310071",
    "title": "Постановление Правительства РФ от 28 декабря 2019 года № 1928",
    "publisher": "publication.pravo.gov.ru",
    "registeredAt": "2026-06-20",
    "accessedAt": null,
    "archiveUrl": null,
    "localCopy": null,
    "sha256": null,
    "status": "referenced",
    "notes": "Источник зарегистрирован автоматически по ссылке в публикации; дата доступа и архивная копия заполняются вручную для ключевых доказательств.",
    "preservationPriority": "medium",
    "referencedBy": [
      "lnr-vyplaty-terakt-118-26"
    ]
  },
  {
    "id": "src-349dad64bfd0",
    "url": "https://lug-info.ru/news/narodnyj-front-pomogaet-likvidirovat-posledstvija-nochnoj-ataki-bpla-v-luganske/",
    "title": "Луганск 8 апреля",
    "publisher": "lug-info.ru",
    "registeredAt": "2026-06-20",
    "accessedAt": null,
    "archiveUrl": null,
    "localCopy": null,
    "sha256": null,
    "status": "referenced",
    "notes": "Источник зарегистрирован автоматически по ссылке в публикации; дата доступа и архивная копия заполняются вручную для ключевых доказательств.",
    "preservationPriority": "normal",
    "referencedBy": [
      "bpla-lnr-2026-05-27"
    ]
  },
  {
    "id": "src-34e86e37cbc5",
    "url": "http://saraliev.com/обратная-связь/",
    "title": "saraliev.com/обратная-связь/",
    "publisher": "saraliev.com",
    "registeredAt": "2026-06-20",
    "accessedAt": null,
    "archiveUrl": null,
    "localCopy": null,
    "sha256": null,
    "status": "referenced",
    "notes": "Источник зарегистрирован автоматически по ссылке в публикации; дата доступа и архивная копия заполняются вручную для ключевых доказательств.",
    "preservationPriority": "medium",
    "referencedBy": [
      "evak-2026-03-10"
    ]
  },
  {
    "id": "src-386de49564cb",
    "url": "https://ihl-databases.icrc.org/en/ihl-treaties/api-1977/article-57",
    "title": "статья 57 Дополнительного протокола I о мерах предосторожности при нападении",
    "publisher": "ihl-databases.icrc.org",
    "registeredAt": "2026-06-20",